Title,URL,PDF_URL,Authors,Citation
Proceedings of the 60th Annual Meeting of the Association for Computational Linguistics: Tutorial Abstracts,https://aclanthology.org/2022.acl-tutorials.0/,https://aclanthology.org/2022.acl-tutorials.0.pdf,"Naoaki Okazaki, Yves Scherrer, Marcos Zampieri",0
A Gentle Introduction to Deep Nets and Opportunities for the Future,https://aclanthology.org/2022.acl-tutorials.1/,https://aclanthology.org/2022.acl-tutorials.1.pdf,"Valia Kordoni, Gary Marcus, Ernest Davis, Yanjun Ma, Zeyu Chen",1
Towards Reproducible Machine Learning Research in Natural Language Processing,https://aclanthology.org/2022.acl-tutorials.2/,https://aclanthology.org/2022.acl-tutorials.2.pdf,"Maurits Bleeker, Samarth Bhargav, Jessica Forde, Koustuv Sinha, Jesse Dodge, Sasha Luccioni, Robert Stojnic",0
Knowledge-Augmented Methods for Natural Language Processing,https://aclanthology.org/2022.acl-tutorials.3/,https://aclanthology.org/2022.acl-tutorials.3.pdf,"Yichong Xu, Xiang Ren, Bill Yuchen Lin, Meng Jiang, Wenhao Yu",0
Non-Autoregressive Sequence Generation,https://aclanthology.org/2022.acl-tutorials.4/,https://aclanthology.org/2022.acl-tutorials.4.pdf,Xu Tan,0
Learning with Limited Text Data,https://aclanthology.org/2022.acl-tutorials.5/,https://aclanthology.org/2022.acl-tutorials.5.pdf,"Ankur Parikh, Colin Raffel",0
Zero- and Few-Shot NLP with Pretrained Language Models,https://aclanthology.org/2022.acl-tutorials.6/,https://aclanthology.org/2022.acl-tutorials.6.pdf,"Arman Cohan, Robert Logan IV, Sewon Min, Sameer Singh",0
Vision-Language Pretraining: Current Trends and the Future,https://aclanthology.org/2022.acl-tutorials.7/,https://aclanthology.org/2022.acl-tutorials.7.pdf,"Damien Teney, Aida Nematzadeh",0
Natural Language Processing for Multilingual Task-Oriented Dialogue,https://aclanthology.org/2022.acl-tutorials.8/,https://aclanthology.org/2022.acl-tutorials.8.pdf,"Goran Glavaš, Olga Majewska, Edoardo Ponti, Ivan Vulić",0
